{
  "event_id": "EVT-REAL-AAPL-2024-05-02",
  "future_source_count": 1,
  "future_source_ids": [
    "SEC-027"
  ],
  "note": "Real-curated validation fixture. Held-out future evidence stays separate from event-time replay inputs.",
  "rows": [
    {
      "expected_observable": "Capital return should be prominent in near-term investor discussion.",
      "future_source_ids": [
        "SEC-027"
      ],
      "label": "pending",
      "narrative_id": "NARR-AAPL-001",
      "what_happened": "Pending future validation; fill only after the validation window closes.",
      "window": "T+20"
    },
    {
      "expected_observable": "Per-share support should matter more than reported product revenue weakness if the buyback narrative dominates.",
      "future_source_ids": [
        "SEC-027"
      ],
      "label": "pending",
      "narrative_id": "NARR-AAPL-001",
      "what_happened": "Pending future validation; fill only after the validation window closes.",
      "window": "T+20"
    },
    {
      "expected_observable": "Follow-up filings should preserve evidence of the newly authorized repurchase program.",
      "future_source_ids": [
        "SEC-027"
      ],
      "label": "validated",
      "narrative_id": "NARR-AAPL-001",
      "what_happened": "Held-out SEC-027, Apple's Q3 2024 Form 10-Q filed after the replay lock, preserved the May 2, 2024 additional $110 billion share repurchase authorization disclosure.",
      "window": "T+60"
    },
    {
      "expected_observable": "Services should remain a central offset to hardware category declines.",
      "future_source_ids": [],
      "label": "pending",
      "narrative_id": "NARR-AAPL-002",
      "what_happened": "Pending future validation; fill only after the validation window closes.",
      "window": "T+20"
    },
    {
      "expected_observable": "Gross margin resilience should matter in interpretation of the quarter.",
      "future_source_ids": [],
      "label": "pending",
      "narrative_id": "NARR-AAPL-002",
      "what_happened": "Pending future validation; fill only after the validation window closes.",
      "window": "T+20"
    },
    {
      "expected_observable": "Future discussion should compare Services growth with product revenue softness.",
      "future_source_ids": [],
      "label": "pending",
      "narrative_id": "NARR-AAPL-002",
      "what_happened": "Pending future validation; fill only after the validation window closes.",
      "window": "T+20"
    },
    {
      "expected_observable": "Hardware-focused analysis should emphasize iPhone, iPad, and Wearables declines.",
      "future_source_ids": [],
      "label": "pending",
      "narrative_id": "NARR-AAPL-003",
      "what_happened": "Pending future validation; fill only after the validation window closes.",
      "window": "T+20"
    },
    {
      "expected_observable": "If this narrative dominates, later commentary should focus on unit demand or product-cycle weakness.",
      "future_source_ids": [],
      "label": "pending",
      "narrative_id": "NARR-AAPL-003",
      "what_happened": "Pending future validation; fill only after the validation window closes.",
      "window": "T+20"
    },
    {
      "expected_observable": "Capital return and Services growth would need to be treated as offsets rather than primary drivers.",
      "future_source_ids": [],
      "label": "pending",
      "narrative_id": "NARR-AAPL-003",
      "what_happened": "Pending future validation; fill only after the validation window closes.",
      "window": "T+20"
    },
    {
      "expected_observable": "Greater China should remain a named risk if the regional narrative is correct.",
      "future_source_ids": [],
      "label": "pending",
      "narrative_id": "NARR-AAPL-004",
      "what_happened": "Pending future validation; fill only after the validation window closes.",
      "window": "T+20"
    },
    {
      "expected_observable": "Later filings or commentary should show whether China weakness persists or stabilizes.",
      "future_source_ids": [],
      "label": "pending",
      "narrative_id": "NARR-AAPL-004",
      "what_happened": "Pending future validation; fill only after the validation window closes.",
      "window": "T+20"
    },
    {
      "expected_observable": "The explanation should be weaker if non-China regions and Services carry the investment debate.",
      "future_source_ids": [],
      "label": "pending",
      "narrative_id": "NARR-AAPL-004",
      "what_happened": "Pending future validation; fill only after the validation window closes.",
      "window": "T+20"
    }
  ],
  "status": "validated"
}
