{
  "event_id": "EVT-REAL-NKE-2024-06-27",
  "future_source_count": 1,
  "future_source_ids": [
    "NKE-IR-FUT-001"
  ],
  "note": "Real-curated validation fixture. Held-out future evidence stays separate from event-time replay inputs.",
  "rows": [
    {
      "expected_observable": "Later reported results should show revenue pressure extending beyond the fourth-quarter release.",
      "future_source_ids": [
        "NKE-IR-FUT-001"
      ],
      "label": "validated",
      "narrative_id": "NARR-NKE-001",
      "what_happened": "Held-out Q1 fiscal 2025 results reported revenue down 10% reported and NIKE Direct revenue down 13%, supporting the replay-time fiscal 2025 demand reset narrative.",
      "window": "T+60"
    },
    {
      "expected_observable": "Future results should keep NIKE Direct and digital revenue declines central.",
      "future_source_ids": [
        "NKE-IR-FUT-001"
      ],
      "label": "pending",
      "narrative_id": "NARR-NKE-002",
      "what_happened": "Held-out Q1 results showed NIKE Direct revenue down 13%, but the public validation label remains pending because the broader demand reset better explains the event-time move.",
      "window": "T+60"
    },
    {
      "expected_observable": "Future commentary should cite Greater China or macro uncertainty as the main driver.",
      "future_source_ids": [
        "NKE-IR-FUT-001"
      ],
      "label": "pending",
      "narrative_id": "NARR-NKE-003",
      "what_happened": "Pending separate curation of the geographic and macro contribution; held-out Q1 results showed declines across geographies but the replay winner was broader.",
      "window": "T+60"
    },
    {
      "expected_observable": "Follow-up discussion should emphasize margin expansion and EPS resilience over demand weakness.",
      "future_source_ids": [
        "NKE-IR-FUT-001"
      ],
      "label": "invalidated",
      "narrative_id": "NARR-NKE-004",
      "what_happened": "Held-out Q1 results still showed gross-margin improvement, but revenue, Direct, wholesale, and EPS declined, weakening a margin-led explanation for the original selloff.",
      "window": "T+60"
    }
  ],
  "status": "validated"
}
