{
  "event_id": "EVT-LYRA-2025-11-13",
  "future_source_count": 1,
  "future_source_ids": [
    "LYR-SRC-009"
  ],
  "status": "synthetic",
  "note": "Synthetic validation is stored separately from event-time replay evidence and must not be visible to generation or ranking steps.",
  "rows": [
    {
      "window": "T+5",
      "label": "partial",
      "narrative_id": "LYR-NARR-002",
      "expected_observable": "The stock underperforms cybersecurity peers over the next 20 trading days.",
      "future_source_ids": [],
      "what_happened": "Synthetic replay: LYRA continued to underperform cybersecurity peers, but the cause was not yet fully separable from broader sector weakness."
    },
    {
      "window": "T+20",
      "label": "validated",
      "narrative_id": "LYR-NARR-002",
      "expected_observable": "Analysts cut net retention or billings quality assumptions within 30 days.",
      "future_source_ids": [
        "LYR-SRC-009"
      ],
      "what_happened": "Synthetic replay: renewal discounting pressure became the validated narrative as later estimate notes focused on net retention and billings quality."
    },
    {
      "window": "T+60",
      "label": "pending",
      "narrative_id": "LYR-NARR-002",
      "expected_observable": "Follow-up commentary focuses on enterprise renewal concessions.",
      "future_source_ids": [],
      "what_happened": "Synthetic replay: left pending to show that consensus tracking should not force every validation window into a binary label."
    }
  ]
}
